{"schema_version":"1.0.0","id":"approval-write-graph","template":"write_with_approval","nodes":[{"id":"propose","kind":"model_decision","label":"Propose change","reads":["input"],"writes":["proposal"],"owner":"model"},{"id":"approve","kind":"human_interrupt","label":"Await approval","reads":["proposal"],"writes":["approval"],"owner":"human"},{"id":"apply","kind":"tool","label":"Apply once","reads":["proposal","approval"],"writes":["result"],"owner":"tool"}],"edges":[{"from":"propose","to":"approve"},{"from":"approve","to":"apply","condition":"approval is fresh"}],"entry_node":"propose","terminal_nodes":["apply"]}
