{"schema_version":"1.0.0","id":"metric-analysis-graph","template":"plan_execute_validate","nodes":[{"id":"plan","kind":"model_decision","label":"Plan metric query","reads":["input"],"writes":["query"],"owner":"model"},{"id":"calculate","kind":"compute","label":"Calculate change","reads":["query","rows"],"writes":["result"],"owner":"code"},{"id":"validate","kind":"validation","label":"Validate answer","reads":["result"],"writes":["answer"],"owner":"code"}],"edges":[{"from":"plan","to":"calculate"},{"from":"calculate","to":"validate"}],"entry_node":"plan","terminal_nodes":["validate"]}
