{"schema_version":"1.0.0","id":"support-triage-graph","template":"tool_loop","nodes":[{"id":"normalize","kind":"normalize","label":"Normalize request","reads":["input"],"writes":["request"],"owner":"code"},{"id":"lookup","kind":"tool","label":"Look up case","reads":["request"],"writes":["case"],"owner":"tool"},{"id":"respond","kind":"output","label":"Draft response","reads":["case"],"writes":["answer"],"owner":"model"}],"edges":[{"from":"normalize","to":"lookup"},{"from":"lookup","to":"respond"}],"entry_node":"normalize","terminal_nodes":["respond"]}
