{"schema_version":"1.0.0","id":"incident-response-graph","template":"incident_response","nodes":[{"id":"observe","kind":"retrieval","label":"Observe signals","reads":["input"],"writes":["signals"],"owner":"tool"},{"id":"contain","kind":"model_decision","label":"Propose containment","reads":["signals"],"writes":["proposal"],"owner":"model"},{"id":"recover","kind":"validation","label":"Verify recovery","reads":["proposal"],"writes":["outcome"],"owner":"code"}],"edges":[{"from":"observe","to":"contain"},{"from":"contain","to":"recover"}],"entry_node":"observe","terminal_nodes":["recover"]}
