{"schema_version":"1.0.0","id":"travel-constraint-graph","template":"router","nodes":[{"id":"collect","kind":"input","label":"Collect constraints","reads":["input"],"writes":["constraints"],"owner":"code"},{"id":"route","kind":"model_decision","label":"Route options","reads":["constraints"],"writes":["route"],"owner":"model"},{"id":"validate","kind":"validation","label":"Validate itinerary","reads":["route","constraints"],"writes":["itinerary"],"owner":"code"}],"edges":[{"from":"collect","to":"route"},{"from":"route","to":"validate","condition":"constraints are complete"}],"entry_node":"collect","terminal_nodes":["validate"]}
